{
  "filed_item_id": "TOMR-dec3362fd2332fb86d3ac46cb29eefeae36dfda879905f3107f05edc4f26ee35",
  "filed_as": {
    "source_id": "SRC-TOMR-0001",
    "held": "held",
    "version": "1",
    "sha256": "1f46b713661bd756280be9be8d94224eb2d8ef9b9f3e03caf423c5568a8f7694",
    "location": "[ORG]AIOC-SL output socket @ SLM-0600aba3e5d8a927341ce6fe09ff9257309c0448fb6397fedf689cd05a6c284f",
    "snapshot_id": "SLM-0600aba3e5d8a927341ce6fe09ff9257309c0448fb6397fedf689cd05a6c284f",
    "origin_kind": "operating model",
    "status": "in force",
    "confidentiality": "internal"
  },
  "origin_kind": "operating model",
  "filed_on_behalf_of": "[ORG]CELL-TDL",
  "write_scope_ref": "REG-EVENT-0042",
  "approval_decision": {
    "source_id": "SRC-DEC-0007",
    "held": "held",
    "version": "1",
    "sha256": "5a25880a9b177703dfb73cf0cd39f2d0c0ea7cd774f1318bcf1ded3b5da3744c",
    "location": "[ORG]AIOC-SL output socket @ SLM-0600aba3e5d8a927341ce6fe09ff9257309c0448fb6397fedf689cd05a6c284f",
    "snapshot_id": "SLM-0600aba3e5d8a927341ce6fe09ff9257309c0448fb6397fedf689cd05a6c284f",
    "origin_kind": "decision",
    "status": "in force",
    "confidentiality": "internal"
  },
  "status_set": "in force",
  "filed_at": "2026-11-21T09:00:00Z"
}
